title,description,image_url,original_url,created_at,website
"La autora de “Bridgerton” habla de la escena polémica: qué haría distinto, el origen de Lady Whistledown y más","Julia Quinn, autora de las novelas que inspiraron la serie “Bridgerton” de Netflix, llegó a Lima como parte de un tour regional que la junta con sus fans. Ella habló con el Comercio de su proceso creativo, de la serie de Netflix y de si el amor es o no lo más importante que existe.",https://elcomercio.pe/resizer/lA95Jn-3FiUoMikUUn1O-zCKisc=/cloudfront-us-east-1.images.arcpublishing.com/elcomercio/I3RLLJUXNZDYFLPDQU6HUW6I3U.jpeg,https://elcomercio.pe/tvmas/series/la-autora-de-bridgerton-habla-de-la-escena-polemica-que-haria-distinto-el-origen-de-lady-whistledown-y-mas-julia-quinn-amabook-noticia/,2024-03-11 00:02:41+00:00,https://elcomercio.pe
“El niño y la garza”: ¿dónde ver en streaming la película ganadora del Oscar 2024?,"La cinta japonesa se impuso en la categoría de Mejor película de animación. De esta manera, el icónica Hayao Miyazaki se llevó a casa el segundo Oscar de su carrera.",https://elcomercio.pe/resizer/U3-Ji1C0DM2Bqpu0_dXXiIBK4tU=/cloudfront-us-east-1.images.arcpublishing.com/elcomercio/VKSGPNEQMNFWVFCWDCIFQT3ANY.jpg,https://elcomercio.pe/saltar-intro/streaming/peliculas/el-nino-y-la-garza-donde-ver-en-streaming-la-pelicula-ganadora-del-oscar-2024-noticia/,2024-03-11 00:02:34+00:00,https://elcomercio.pe
"RESULTADO, Colo Colo 0-1 U. de Chile por el Superclásico de Chile | VIDEO",TNT Sports en vivo: Colo Colo vs U. de Chile por Campeonato Nacional | TNT Sports en vivo transmiten el clásico Colo Colo vs U. de Chile por el Campeonato Nacional de Chile.,https://elcomercio.pe/resizer/DX_Zq--IFL5jB7bRTz1iArx-HTo=/cloudfront-us-east-1.images.arcpublishing.com/elcomercio/H5M3YN5YURHA5F52RGN3CVQXBA.jpeg,https://elcomercio.pe/deporte-total/futbol-mundial/tnt-sports-en-vivo-ver-colo-colo-u-de-chile-gratis-en-directo-estadio-tnt-sports-tnt-sports-go-tnt-sports-hd-y-tnt-sports-2-por-campeonato-nacional-de-chile-2024-video-cl-noticia/,2024-03-11 00:02:05+00:00,https://elcomercio.pe
U. de Chile venció a Colo Colo por el Campeonato Nacional 2024 | RESUMEN Y GOLES,Colo Colo no pudo ante U. de Chile por la fecha 4 del Campeonato Nacional de Chile.,https://elcomercio.pe/resizer/mubzUPHXotswN0Qf2Yd9xw_kCDM=/cloudfront-us-east-1.images.arcpublishing.com/elcomercio/XZ7MIGI5HRA4TPSVFAJGNNCGSA.jpg,https://elcomercio.pe/deporte-total/futbol-mundial/resumen-colo-colo-vs-u-de-chile-hoy-superclasico-campeonato-nacional-2023-video-noticia/,2024-03-11 00:01:56+00:00,https://elcomercio.pe
"La historia del diseñador peruano Jorge Luis Salinas, quien conquista Milán con colección inspirada en el huaylarsh","El diseñador que vio nacer el emporio de Gamarra brilló en la Semana de la Moda de Milán con una colección inspirada en la danza típica del Ande peruano. Entre los invitados a la cita, destacaron figuras como Anna Dello Russo y Nina García.",https://elcomercio.pe/resizer/-REkR2LofPiZUy7lpO2CVWmX2HU=/cloudfront-us-east-1.images.arcpublishing.com/elcomercio/43K56VWVEFGHXB6PLDKMAJ7JAE.jpg,https://elcomercio.pe/luces/moda/disenador-peruano-jorge-luis-salinas-lleva-el-colorido-del-huaylarsh-a-milan-moda-gamarra-disenador-peruano-noticia/,2024-03-11 00:01:50+00:00,https://elcomercio.pe
"Quién es Jack Teixeira, el militar que filtró documentos secretos del Pentágono y la pena que podría recibir","Jack Teixeira llegó a un acuerdo con la Fiscalía de Estados Unidos para no ser acusado de espionaje, delito por el que pudo pasar décadas en la cárcel. Esta es la historia",https://elcomercio.pe/resizer/U0pvWzaMGHyml9xGl1wdTb4rlO8=/cloudfront-us-east-1.images.arcpublishing.com/elcomercio/XKXHCMAYORH7FPA4NNA3VPHUXE.jpg,https://elcomercio.pe/mundo/eeuu/jack-teixeira-quien-es-el-militar-estadounidense-que-se-declaro-culpable-de-filtrar-documentos-secretos-del-pentagono-y-la-pena-que-podria-recibir-estados-unidos-que-hizo-jack-teixeira-que-documentos-filtro-jack-teixeira-noticia/,2024-03-11 00:01:29+00:00,https://elcomercio.pe
"El lado B de La Mar: un recorrido por las tiendas de moda, arte y decoración de la avenida miraflorina","Más allá de sus espacios gastronómicos, la visitada avenida miraflorina posee una gran oferta comercial, con tiendas de moda, arte y decoración. Hicimos un recorrido y esto fue lo que encontramos.",https://elcomercio.pe/resizer/jK4jwLFUoqs1BmfU7dF0WZKZB5c=/cloudfront-us-east-1.images.arcpublishing.com/elcomercio/BOY6HRJOJRCFBOJRZYUZXDW2KQ.JPG,https://elcomercio.pe/somos/estilo/el-lado-b-de-la-mar-un-recorrido-por-las-tiendas-de-moda-arte-y-decoracion-de-la-avenida-miraflorina-tiendas-restaurantes-locales-comerciales-arte-musica-historias-ec-noticia/,2024-03-11 00:01:00+00:00,https://elcomercio.pe
Convocatoria de Jorge Fossati en vivo: lista de convocados,Convocatoria de Fossati en vivo: cómo va la conferencia de prensa en La Videna | Sigue en vivo la convocatoria de Jorge Fossati para los amistosos de Perú vs. Nicaraguay y República Dominicana.,https://elcomercio.pe/resizer/flomW-jiX85kbxDh3CCRbdPDQng=/cloudfront-us-east-1.images.arcpublishing.com/elcomercio/3QEBKKBDERHW3PU5Y3GVTJ5OMA.jpg,https://elcomercio.pe/deporte-total/seleccion/convocatoria-de-jorge-fossati-en-vivo-online-gratis-lista-de-citados-jugadores-convocados-para-amistosos-de-peru-vs-nicaraguay-y-republica-dominicana-video-noticia/,2024-03-11 00:00:46+00:00,https://elcomercio.pe
"Más de 200 taxistas del aeropuerto Jorge Chávez denunciados por robo, violación, homicidio y hasta secuestro",,https://elcomercio.pe/resizer/m2rHO1_qC-jd_lX4ka_rtTwOeXs=/cloudfront-us-east-1.images.arcpublishing.com/elcomercio/V3SAKBOOTJDTFKDY2KOCOG5YLI.jpg,https://elcomercio.pe/lima/seguridad/mas-de-200-taxistas-del-aeropuerto-jorge-chavez-denunciados-por-robo-violacion-homicidio-y-hasta-secuestro-noticia/,2024-03-11 00:00:00+00:00,https://elcomercio.pe
Pobreza se reduciría a un quinto con ejecución de cartera minera,"El aporte de estos proyectos equivaldría al 226% del PBI y al 177% de la recaudación del 2023. Sin embargo, 23 de los 46 proyectos en la cartera enfrentan retrasos por razones ajenas a las empresas.",https://elcomercio.pe/resizer/TGC2TLPPppRiJdXD-c60eubuV2Q=/cloudfront-us-east-1.images.arcpublishing.com/elcomercio/OSGYQAYBQNDL5GRIFIPETOU2AY.jpg,https://elcomercio.pe/economia/ipe-pobreza-se-reduciria-a-un-quinto-con-ejecucion-de-cartera-minera-inversion-privada-economia-produccion-metalica-noticia/,2024-03-10 23:59:45+00:00,https://elcomercio.pe
“Rara vez el líder de la carrera recibió tanta poca atención de las cámaras de televisión”: El fenómeno que refleja el dominio abrumador de Verstappen en la F1 | ANÁLISIS,"Max Verstappen volvió a imponerse y Red Bull cerró otro 1-2. Con tan solo dos fechas disputadas, la categoría parece estar dominada por los toros alados, mientras que en la retaguardia se vive una cuenta regresiva, esperando que el azar juegue su papel.",https://elcomercio.pe/resizer/I0dhwXqhtd_jOj9bnGySGbvSw2A=/cloudfront-us-east-1.images.arcpublishing.com/elcomercio/OP66KQWIINCKVEJC7TVMXQA3NM.jpg,https://elcomercio.pe/deporte-total/futbol-peruano/max-verstappen-y-el-fenomeno-que-refleja-su-dominio-abrumador-en-la-formula-1-rara-vez-el-lider-de-la-carrera-recibio-tanta-poca-atencion-de-las-camaras-de-television-red-bull-f1-noticia/,2024-03-10 23:59:28+00:00,https://elcomercio.pe
Deportes en comunidad: la tendencia que se impone en Lima y sus beneficios para la salud,"Las disciplinas y deportes compartidos en comunidad siguen ganando terreno. Entrenar en grupo puede ser una experiencia inigualable, que fortalece la confianza en nosotros mismos y nos ayuda a ser constantes con los buenos hábitos. ¿Cómo se logra? Nos lo cuentan los gestores de este gran movimiento.",https://elcomercio.pe/resizer/WJ93tDde0AZIS-PVHjzHa_ijzGg=/cloudfront-us-east-1.images.arcpublishing.com/elcomercio/FODOUZ24FVBZLMNMBPKQ6DXJRA.jpg,https://elcomercio.pe/somos/estilo/deportes-en-comunidad-la-tendencia-que-se-impone-en-lima-y-sus-beneficios-para-la-salud-boost-studio-siclo-ballet-y-pilates-salud-mental-fightlab-historias-ec-noticia/,2024-03-10 23:59:09+00:00,https://elcomercio.pe
Texas es un espejo de las tensiones en la carrera hacia la Casa Blanca (y no solo por la inmigración),"La delicada situación en la frontera con México será el tema crucial en la campaña presidencial en EE.UU. En el estado conservador más poblado y rico del país, una batalla legal con el gobierno federal y otras pugnas calientan el ambiente electoral.",https://elcomercio.pe/resizer/bJDXq4oMOsx7onWv1Tg0UBeUvQA=/cloudfront-us-east-1.images.arcpublishing.com/elcomercio/WI6GXEIP7NGGZEMRAHMKR5IG7A.jpeg,https://elcomercio.pe/mundo/eeuu/texas-donald-trump-joe-biden-texas-es-un-espejo-de-las-tensiones-en-la-carrera-hacia-la-casa-blanca-y-no-solo-por-la-inmigracion-noticia/,2024-03-10 23:58:51+00:00,https://elcomercio.pe
Venezuela tendrá una “seudoelección” presidencial,"Horas después de que el dictador venezolano Nicolás Maduro anunciara que celebraría sus fraudulentas elecciones presidenciales el 28 de julio, quedó claro que obtuvo una victoria propagandística: la mayoría de los medios y muchos jefes de Estado aceptaron automáticamente referirse a su farsa electoral como una “elección”.",https://elcomercio.pe/resizer/sH-Es-YN4TYIBP0OPbjTNFr2w7I=/cloudfront-us-east-1.images.arcpublishing.com/elcomercio/5I3XKVYGFVF55IJJK2IG55GVFU.jpg,https://elcomercio.pe/opinion/columnistas/nicolas-madura-venezuela-tendra-una-seudoeleccion-presidencial-por-andres-oppenheimer-noticia/,2024-03-10 23:58:35+00:00,https://elcomercio.pe
Carlos Zambrano vuelve a las canchas en Alianza Lima vs. Sporting Cristal por Liga 1 Te Apuesto | VIDEO,El ‘Pirata’ Barcos anotó el tanto de la ventaja ‘blanquiazul’ desde los doce pasos ante Cristal por la Liga 1 Te Apuesto.,https://elcomercio.pe/resizer/1Fxk9qT5QKQDcWPXW5HPdvXSOCQ=/cloudfront-us-east-1.images.arcpublishing.com/elcomercio/47HC6AK5GVCQFLOGD46CIZ6N2I.jpg,https://elcomercio.pe/deporte-total/futbol-peruano/carlos-zambrano-vuelve-a-las-canchas-en-alianza-lima-vs-sporting-cristal-por-liga-1-te-apuesto-tras-486-dias-video-l1ta-noticia/,2024-03-10 23:57:22+00:00,https://elcomercio.pe
Oscars 2024: Los looks de las celebridades en la alfombra roja,,,https://elcomercio.pe/viu/moda/oscars-2024-los-looks-de-las-celebridades-en-la-alfombra-roja-premios-oscar-famosas-looks-vestidos-noticia/,2024-03-10 21:45:05+00:00,https://elcomercio.pe
“American Fiction”: ¿dónde ver en streaming la película ganadora del Oscar?,Cord Jefferson dirige el filme que adapta la novela “Erasure” de Percival Everett. Te contamos en qué plataforma la puedes ver en streaming.,https://elcomercio.pe/resizer/xVb6Zj3BspIKMWrdpoMEh-_xdKI=/cloudfront-us-east-1.images.arcpublishing.com/elcomercio/Z7N5JVBKPVFYNDATZASXD5HZCQ.jpg,https://elcomercio.pe/saltar-intro/prime-video/peliculas/american-fiction-donde-ver-en-streaming-la-pelicula-ganadora-del-oscar-2024-noticia/,2024-03-10 23:53:40+00:00,https://elcomercio.pe
Bicameralidad sin partidos,El plan mínimo debe resumirse en una meta: mejorar la representación política prescindiendo de partidos.,https://elcomercio.pe/resizer/R4pEi5CMRdEjbOIk0w0_sVgY0tM=/cloudfront-us-east-1.images.arcpublishing.com/elcomercio/AJEVQFZEYZDTHCTLLRAWQ4BZHQ.jpg,https://elcomercio.pe/opinion/columnistas/invierno-hungaro-congreso-politica-partidos-bicameralidad-sin-partidos-por-carlos-melendez-noticia/,2024-03-10 23:53:03+00:00,https://elcomercio.pe
Los ronroneos de Otárola,,https://elcomercio.pe/resizer/935kKV2QaOw850mu49U852PaBik=/cloudfront-us-east-1.images.arcpublishing.com/elcomercio/UHZNWEWWGRD5XCFNY2L357O3J4.jpeg,https://elcomercio.pe/opinion/columnistas/gabinete-gobierno-los-ronroneos-de-alberto-otarola-por-hector-villalobos-noticia/,2024-03-10 23:52:05+00:00,https://elcomercio.pe
El Tribunal Constitucional entra en política,"El Tribunal Constitucional (TC) ha emitido una resolución histórica. Histórica, sobre todo, porque rompe con la Constitución.",https://elcomercio.pe/resizer/FPpPKRRoHEhHPuQsCr59iVewZa4=/cloudfront-us-east-1.images.arcpublishing.com/elcomercio/OO6ZNJAWOBHYVPUJJH2PH4GPMU.jpg,https://elcomercio.pe/opinion/columnistas/el-tribunal-constitucional-entra-en-politica-por-federico-salazar-noticia/,2024-03-10 23:51:51+00:00,https://elcomercio.pe
Calles de miedo,"Mientras el Gobierno insiste en estrategias y ministros inoperantes, la inseguridad ciudadana sigue en aumento.",https://elcomercio.pe/resizer/IrqA-JoI-rAET-Z1HS8iuj0ZeMo=/cloudfront-us-east-1.images.arcpublishing.com/elcomercio/URHM655JEZDBBP35HRD77INMKQ.jpeg,https://elcomercio.pe/opinion/editorial/el-gobierno-insiste-en-estrategias-y-ministros-inoperantes-la-inseguridad-ciudadana-sigue-en-aumento-noticia/,2024-03-10 23:51:37+00:00,https://elcomercio.pe
Un Congreso bicameral: ¿qué figuras de los partidos políticos se perfilan para el Senado en el 2026?,El Congreso aprobó la reforma constitucional para restituir la bicameralidad y los partidos políticos ya barajan sus cartas. Los candidatos presidenciales también podrán postular a la cámara alta,https://elcomercio.pe/resizer/OjcKPBsam2-FRVj1c0RxE5bKz0I=/cloudfront-us-east-1.images.arcpublishing.com/elcomercio/D25RZPURHFFS3KY5J4HSGSKBKI.png,https://elcomercio.pe/politica/congreso/un-congreso-bicameral-que-figuras-de-los-partidos-politicos-se-perfilan-para-el-senado-en-el-2026-bicameralidad-elecciones-2026-noticia/,2024-03-10 23:50:55+00:00,https://elcomercio.pe
Enzo Vogrincic enamoró a su paso por la alfombra roja de los Oscars 2024 | FOTOS,"El actor uruguayo estuvo en la ceremonia realizada en Los Ángeles junto a la comitiva de “La sociedad de la nieve”, película que estuvo nominada en la categoría de Mejor película extranjera.",,https://elcomercio.pe/saltar-intro/noticias/enzo-vogrincic-lucio-asi-en-la-alfombra-roja-de-los-premios-oscar-2024-la-sociedad-de-la-nieve-fotos-noticia/,2024-03-10 23:50:00+00:00,https://elcomercio.pe
“El niño y la garza” se lleva el premio a Mejor película animada,El ganador en una batalla muy dura a Mejor película animada se lo ha llevado “El niño y la garza”. Aquí te contamos todo lo que pasó en la gala.,https://elcomercio.pe/resizer/8-z6ULGfiKaruKxPQcwNUwQeMxo=/cloudfront-us-east-1.images.arcpublishing.com/elcomercio/TKPUOIKVAVBWDDRO3R4MNHIYKQ.jpeg,https://elcomercio.pe/saltar-intro/hbo/peliculas/el-nino-y-la-garza-se-lleva-el-premio-a-mejor-pelicula-animada-studio-ghibli-noticia/,2024-03-10 23:44:42+00:00,https://elcomercio.pe
"ESPN en vivo | VER, Brasil vs. Estados Unidos por la final de Copa Oro 2024",ESPN por Star Plus transmite Brasil vs. Estados Unidos Femenino desde el Snapdragon Stadium de California.,https://elcomercio.pe/resizer/TgtBjpldiieQFBHoBmvXAv2OiaI=/cloudfront-us-east-1.images.arcpublishing.com/elcomercio/FF5FILFYVRDOTCIOLL2EIWWMVA.jpg,https://elcomercio.pe/deporte-total/futbol-mundial/espn-en-vivo-brasil-vs-estados-unidos-femenino-hoy-online-via-futbol-libre-tv-star-plus-cbs-paramount-espn-espn-deportes-que-canal-transmite-y-en-donde-se-puede-ver-la-final-por-copa-oro-2024-link-streaming-video-noticia/,2024-03-10 23:42:58+00:00,https://elcomercio.pe
Brasil vs. Estados Unidos Femenino en vivo: horario del partido y en qué canal transmiten por Copa Oro 2024,Sigue la transmisión del partido de Brasil vs. Estados Unidos Femenino en vivo online por la gran final de la Copa Oro 2024.,https://elcomercio.pe/resizer/FsBGACHVq_pOPLcgJ0lG36FRJU4=/cloudfront-us-east-1.images.arcpublishing.com/elcomercio/5XA4IAUZIFDCVMBCBXHPGCPNIM.jpeg,https://elcomercio.pe/deporte-total/futbol-mundial/brasil-vs-estados-unidos-en-vivo-online-gratis-por-final-de-copa-oro-2024-a-que-hora-juegan-canal-tv-transmision-y-donde-ver-brasil-vs-usa-via-espn-star-plus-cbs-paramount-espn-y-futbol-libre-tv-apuestas-pronostico-video-noticia/,2024-03-10 23:42:47+00:00,https://elcomercio.pe
"Temblor en Colombia HOY, domingo 10 de marzo: magnitud, lugar, hora e intensidad reportado",Temblor en Colombia: mira aquí los reportes del Servicio Geológico Colombiano (SGC) sobre los últimos sismos ocurridos en el país.,https://elcomercio.pe/resizer/aFIMRhHzYV_ND_3R6f8k4NcG5gQ=/cloudfront-us-east-1.images.arcpublishing.com/elcomercio/FNJDWYPBINBH5BPEPMKK7QN3YQ.jpg,https://elcomercio.pe/respuestas/colombia/temblor-en-colombia-hoy-en-vivo-ultimo-sismo-10-y-11-de-marzo-reporte-de-magnitud-epicentro-y-hora-segun-sgc-servicio-geologico-colombiano-servicio-geologico-colombiano-bogota-meta-santander-co-lbposting-noticia/,2024-03-10 23:42:41+00:00,https://elcomercio.pe
"Temblor en Chile hoy, domingo 10 de marzo: reportes de los últimos sismos según el CSN","Temblor en Chile hoy EN VIVO: magnitud, lugar y reporte del último sismo en el país según el Centro Sismológico Nacional (CSN).",https://elcomercio.pe/resizer/wqP80AnyjSo_BBPiPRGqkx1oxWA=/cloudfront-us-east-1.images.arcpublishing.com/elcomercio/APNYDTCJDNCBTBIS3LB32TT2ZU.jpg,https://elcomercio.pe/respuestas/chile/temblor-en-chile-hoy-en-vivo-ultimo-sismo-del-10-y-11-de-marzo-magnitud-epicentro-profundidad-y-hora-reportados-centro-sismologico-nacional-la-caldera-valparaiso-lbposting-noticia/,2024-03-10 23:42:36+00:00,https://elcomercio.pe
“Spider-Man: A través del Spider-Verso”: ¿dónde ver en streaming la nominada al Oscar 2024?,La ganadora del Oscar a la Mejor película de animación de la ceremonia 2024 fue un éxito de taquilla en cines y aquí te contamos cómo disfrutarla en streaming.,https://elcomercio.pe/resizer/KNB0z0Jtl6mErqnXW2EwVuJET6c=/cloudfront-us-east-1.images.arcpublishing.com/elcomercio/V5GB6F2MNZEYBGVXEAIN2TNRJE.PNG,https://elcomercio.pe/saltar-intro/hbo/peliculas/spider-man-a-traves-del-spider-verso-donde-ver-en-streaming-la-nominada-al-oscar-2024-hbo-max-hombre-arana-noticia/,2024-03-10 23:42:18+00:00,https://elcomercio.pe
Oscar 2024: estos fueron los looks de la alfombra roja | FOTOS,,,https://elcomercio.pe/saltar-intro/noticias/oscar-2024-estos-son-los-mejores-looks-de-la-alfombra-roja-fotos-noticia/,2024-03-10 23:38:05+00:00,https://elcomercio.pe
Clima en Perú EN VIVO domingo 10 de marzo: temperaturas y pronósticos en Lima y provincias,"Clima en Perú EN VIVO: Conoce en la siguiente nota el pronostico del clima y temperaturas en las diferentes regiones del Perú, según el Servicio Nacional de Meteorología e Hidrología.",https://elcomercio.pe/resizer/FwDR0AoEFY6a4j3sOB-PS5nWeXM=/cloudfront-us-east-1.images.arcpublishing.com/elcomercio/IS6EOWSDCJDXHO7YUUWIXNMYDI.jpg,https://elcomercio.pe/respuestas/clima-en-lima-en-vivo-pronostico-hoy-segun-el-senamhi-para-peru-y-provincias-ola-de-calor-sensacion-termica-radiacion-uv-fenomeno-del-nino-ultima-hora-lbposting-noticia/,2024-03-10 23:34:39+00:00,https://elcomercio.pe
Examen de admisión San Marcos 2024: resultados y puntajes,,https://elcomercio.pe/resizer/5YEfAlgCIUBVhvCmiCpRVvj9iaY=/cloudfront-us-east-1.images.arcpublishing.com/elcomercio/VTRJP4E5JNF4LFASIELXPATWLM.jpg,https://elcomercio.pe/respuestas/estudios-carreras/examen-san-marcos-2024-en-vivo-hoy-resultados-vacantes-puntajes-del-examen-admision-de-sabado-9-y-domingo-10-marzo-cuanto-es-puntaje-minimo-horario-puertas-de-ingreso-unmsm-lbposting-noticia/,2024-03-10 23:34:34+00:00,https://elcomercio.pe
La doble B,"Mediodía del 11 de enero de 1965. Es un lunes, pero huele a viernes en el aeropuerto Jorge Chávez: acaba de aterrizar la diva francesa Brigitte Bardot, la famosa BB, elevada por los hombres de aquel tiempo a una categoría que con el paso del tiempo dejaría de ser consagratoria para volverse denigrante: sex symbol.",https://elcomercio.pe/resizer/nLHR1csck3bdohhGvbYc3JMAQiI=/cloudfront-us-east-1.images.arcpublishing.com/elcomercio/KFB7EHGKNJEERN67BXE5S3Q4CE.jpg,https://elcomercio.pe/archivo-elcomercio/dia-de-la-mujer-brigitte-bardot-en-lima-por-lulu-beltran-noticia/,2024-03-10 13:00:37+00:00,https://elcomercio.pe
"“No me preocupa tanto el avance chino, sino que Estados Unidos no está dando la respuesta adecuada”","El gigante asiático tiene ya mucho terreno ganado en Latinoamérica. ¿En qué radica dicho avance? El ex candidato presidencial reflexiona sobre esto y comparte, también, sus impresiones sobre la bicameralidad y el nuevo jefe del Gabinete.",https://elcomercio.pe/resizer/ImXFfF8Pn5pZBTWQ_k262Imi8yA=/cloudfront-us-east-1.images.arcpublishing.com/elcomercio/2KE2D7Q2QJHVPAKD6MOWMIL2QU.jpg,https://elcomercio.pe/economia/hernando-de-soto-no-me-preocupa-tanto-el-avance-chino-sino-que-estados-unidos-no-esta-dando-la-respuesta-adecuada-entrevista-china-instituto-libertad-y-democracia-latinoamerica-noticia/,2024-03-10 23:32:20+00:00,https://elcomercio.pe
"Patricia Benavides realizó “coordinaciones indebidas” hasta con ocho fuerzas políticas, según fiscalía","De acuerdo con la precisión de hechos realizada por la fiscal Delia Espinoza, la presunta red criminal habría buscado apoyo particularmente en la bancada de Fuerza Popular, pero también con representantes de otras seis bancadas.",https://elcomercio.pe/resizer/OVu0NNMIBmUyp86xJswPwHlgD-g=/cloudfront-us-east-1.images.arcpublishing.com/elcomercio/6TOHKIXI25BQLMHZAC2GARC66E.jpg,https://elcomercio.pe/politica/justicia/patricia-benavides-realizo-coordinaciones-indebidas-hasta-con-ocho-fuerzas-politicas-segun-fiscalia-red-criminal-fuerza-popular-delia-espinoza-keiko-fujimori-noticia/,2024-03-10 23:31:46+00:00,https://elcomercio.pe
“La inseguridad debería ser la gran tarea de Gustavo Adrianzén”,El periodista y antropólogo está convencido de que la guerra ideológica debe terminar si el Perú no quiere seguir en el foso. Cree que la culminación del proceso a la JNJ debe poner fin a la confrontación entre dos bandos.,https://elcomercio.pe/resizer/wBfGIGFpRmmsnYbZ6atm8cHcXbg=/cloudfront-us-east-1.images.arcpublishing.com/elcomercio/JIQ2ENO2EVFBDLQEYDHSLDIUKM.jpeg,https://elcomercio.pe/politica/actualidad/jaime-de-althaus-periodista-y-antropologo-la-inseguridad-deberia-ser-la-gran-tarea-de-gustavo-adrianzen-noticia/,2024-03-10 23:31:28+00:00,https://elcomercio.pe
"Sin Cauteruccio pero con Grimaldo iluminado: Cristal volteó 2-1 a Alianza, silenció el Nacional y es único líder de la Liga 1 Te Apuesto | CRÓNICA","Sin Cauteruccio por un problema de salud, pero con un Grimaldo iluminado, Cristal volteó 2-1 a Alianza y es líder en solitario de la Liga 1 Te Apuesto.",https://elcomercio.pe/resizer/tOqlS2TGC1mNQ8LqhzvdQyhsjP4=/cloudfront-us-east-1.images.arcpublishing.com/elcomercio/RD2FAXEXCBH2JC7HZGEW4CW5EY.jpg,https://elcomercio.pe/deporte-total/futbol-peruano/sin-martin-cauteruccio-pero-con-joao-grimaldo-iluminado-sporting-cristal-volteo-2-1-a-alianza-lima-silencio-el-nacional-y-es-unico-lider-de-la-liga-1-te-apuesto-l1ta-noticia/,2024-03-10 23:31:12+00:00,https://elcomercio.pe
Selección peruana: cómo llega la base que utilizará Fossati y quién jugó más este 2024,Te contamos cómo ha venido siendo el trabajo de Jorge Fossati en estas semanas a su carga y sobre su lista de cara a los partidos ante Nicaragua y República Dominicana.,https://elcomercio.pe/resizer/DkAVRKSIIMyw4oLxRiR5s_N9fuE=/cloudfront-us-east-1.images.arcpublishing.com/elcomercio/EYFCWVOGD5H2VGS7WDZPQJVACI.jpg,https://elcomercio.pe/deporte-total/seleccion/seleccion-peruana-como-llega-la-base-que-utilizara-fossati-y-quien-jugo-mas-este-2024-peru-vs-nicaragua-peru-vs-republica-dominicana-guerrero-advincula-tapia-carrillo-noticia/,2024-03-11 01:30:00+00:00,https://elcomercio.pe
La historia detrás del trágico incendio que devastó Palacio de Gobierno en 1921,El sonido de las campanas de los templos y los silbatos de la policía en señal de alarma irrumpieron la tarde de domingo. Era el 3 de julio de 1921 y la sede de Palacio de Gobierno había comenzado a arder en llamas.,https://elcomercio.pe/resizer/ii9mTugg9jies7vHwSYagrz85nA=/cloudfront-us-east-1.images.arcpublishing.com/elcomercio/MC5N3AV6UFGQPGQZM6L3KYXM34.jpg,https://elcomercio.pe/politica/gobierno/memoria-politica-incendio-en-palacio-de-gobierno-ardio-en-llamas-augusto-b-leguia-1921-archivo-el-comercio-noticia/,2024-03-10 23:30:40+00:00,https://elcomercio.pe
"Así luce Pataz, una de las zonas más peligrosas del Perú en medio del estado de emergencia: ¿cuántos detenidos hay?","Fuerzas combinadas de la Policía y el Ejército continúan realizando acciones para reforzar la seguridad en la provincia de Pataz, en La Libertad, donde el crimen organizado vinculado a la minería ilegal obligó que se declare el estado de emergencia hace 20 días. El ministro de Defensa, Walter Astudillo y el jefe del Comando Conjunto de las Fuerzas Armadas, el general David Ojeda y su Estado Mayor Conjunto, viajaron  a la zona.",https://elcomercio.pe/resizer/-mGDNrrx-roUfQE-yRa1yCC3Wm4=/cloudfront-us-east-1.images.arcpublishing.com/elcomercio/K4KKJQXAQJCOLKLHKMQTAQO4BI.jpg,https://elcomercio.pe/peru/la-libertad/mineria-ilegal-pataz-asi-luce-una-de-las-zonas-mas-peligrosas-del-peru-en-medio-del-estado-de-emergencia-fotos-fuerzas-armadas-pnp-ejercito-operativos-de-control-noticia/,2024-03-10 23:30:21+00:00,https://elcomercio.pe
"UFC 299, ‘Chito’ Vera perdió ante O’Malley por decisión unánime",UFC 299 se desarrolló con la pelea entre Sean O’Malley vs. Marlon ‘Chito’ Vera como el principal atractivo.,https://elcomercio.pe/resizer/zgxcCPa93NZLdXPMLmW1Womyem4=/cloudfront-us-east-1.images.arcpublishing.com/elcomercio/KOC7M5ZZWRE65LT4D6ZKRRI4XI.jpg,https://elcomercio.pe/deporte-total/polideportivo/ufc-299-en-vivo-chito-vera-vs-omalley-2-online-gratis-via-espn-fox-sports-premium-fox-sports-star-plus-eurosport-ufc-fight-pass-a-que-hora-es-cartelera-canal-tv-gratis-y-donde-ver-live-streaming-pronostico-apuestas-resultados-video-mx-eeuu-noticia/,2024-03-10 23:27:45+00:00,https://elcomercio.pe
