title,description,image_url,original_url,created_at,website
Día de la Mujer 2024: Comparte hoy imágenes y gifs para conmemorar el 8 de marzo,Acá te mostramos algunas alternativas para que puedas enviar por el Día de la Mujer este 8 de marzo,https://elcomercio.pe/resizer/1frYhfjJ-9b3Iq_8ziM9GGxORh0=/cloudfront-us-east-1.images.arcpublishing.com/elcomercio/JUODIB2ZQZADFJN5PIGCVWJUQM.jpg,https://elcomercio.pe/respuestas/trends/las-mejores-imagenes-y-gifs-para-enviar-este-8-de-marzo-por-el-dia-de-la-mujer-tdpe-noticia/,2024-03-08 22:57:01+00:00,https://elcomercio.pe
¿Qué comerán las estrellas en la fiesta del Oscar 2024? Un vistazo a su selecta carta,"El Oscar continúa en el after party. Por 30 años, el chef Wolfgang Puck ha creado el menú que prueban 1,500 figuras de Hollywood. Una carta que ha sido pensada para satisfacer todos los gustos.",https://elcomercio.pe/resizer/QHIYFB7-xe5eDWv_VNjZz37yjYQ=/cloudfront-us-east-1.images.arcpublishing.com/elcomercio/GW33G2VB2FCV5DVU7D3E3TPMSA.jpg,https://elcomercio.pe/provecho/tendencias/premios-oscar-que-comeran-las-estrellas-de-hollywood-risotto-lasanas-veganas-y-chocolates-empolvados-con-oro-son-parte-del-menu-oscar-2024-noticia/,2024-03-08 22:57:00+00:00,https://elcomercio.pe
Día de la Mujer 2024: Descubre la historia detrás de la conmemoración del 8 de marzo,Este 8 de marzo volveremos a conmemorar el Día de la Mujer. ¿Sabes a qué se debe este efemérides? Descúbrelo en esta nota.,https://elcomercio.pe/resizer/KTbTcxhU6XUvDMyTFDovYbjMNAk=/cloudfront-us-east-1.images.arcpublishing.com/elcomercio/IIJOEYOYV5H5NASXK6GXQHPOM4.png,https://elcomercio.pe/respuestas/dia-de-la-mujer-2024-origen-historia-y-por-que-se-conmemora-cada-8-de-marzo-8-m-derechos-de-la-mujer-efemeride-tdpe-noticia/,2024-03-08 22:56:08+00:00,https://elcomercio.pe
¡Feliz Día de la Mujer 2024!: Este 8 de marzo dedica las mejores frases y mensajes,100 frases por el “Día de la Mujer” para compartir el próximo 8 de marzo | En la siguiente nota te compartimos 100 frases inspiradoras y reflexivas para esta fecha tan importante en el calendario mundial.,https://elcomercio.pe/resizer/BWPyxf7G3lQ8sv4jlXs17MUBpPo=/cloudfront-us-east-1.images.arcpublishing.com/elcomercio/QLKTAPXZNVF35JNMYXCW6B7X2Y.jpg,https://elcomercio.pe/respuestas/trends/100-frases-por-el-dia-de-la-mujer-para-compartir-el-proximo-8-de-marzo-tdpe-noticia/,2024-03-08 22:54:27+00:00,https://elcomercio.pe
"Temblor en Chile hoy, según el CSN: epicentro y magnitud de los sismos del 8 de marzo","Temblor en Chile hoy EN VIVO: magnitud, lugar y reporte del último sismo en el país según el Centro Sismológico Nacional (CSN).",https://elcomercio.pe/resizer/wqP80AnyjSo_BBPiPRGqkx1oxWA=/cloudfront-us-east-1.images.arcpublishing.com/elcomercio/APNYDTCJDNCBTBIS3LB32TT2ZU.jpg,https://elcomercio.pe/respuestas/chile/temblor-en-chile-hoy-en-vivo-magnitud-epicentro-intensidad-y-profundidad-del-ultimo-sismo-de-marzo-segun-el-csn-centro-sismologico-nacional-la-caldera-valparaiso-lbposting-noticia/,2024-03-08 22:49:09+00:00,https://elcomercio.pe
Miles de mujeres argentinas marcharon por el 8M y protestaron contra las medidas antifeministas de Milei,Día de la Mujer | Decenas de miles de mujeres y colectivos por la diversidad de Argentina marchan este viernes “con fuerza renovada” en repudio a las medidas antifeministas del presidente ultraliberal Javier Milei y de su “motosierra” para recortar el gasto público.,https://elcomercio.pe/resizer/kDLO_-syY4mOFGZJLBpxoLWv_8A=/cloudfront-us-east-1.images.arcpublishing.com/elcomercio/VFNXRKUA5RF7NE4EWHVQOXI6BE.jpg,https://elcomercio.pe/mundo/latinoamerica/marcha-por-el-8m-en-argentina-dia-de-la-mujer-miles-de-mujeres-argentinas-marcharon-por-el-8m-y-protestaron-contra-las-medidas-antifeministas-de-javier-milei-ultimas-noticia/,2024-03-08 22:45:00+00:00,https://elcomercio.pe
"Dónde ver la Final de Miss Mundo 2024: Día, horario y cómo seguir online","Consulta el horario de transmisión y cómo seguir EN VIVO la gran final del Miss Mundo, edición 71.",https://elcomercio.pe/resizer/1idlBFEapIL86f6CrQWOsvoV_dc=/cloudfront-us-east-1.images.arcpublishing.com/elcomercio/N5YDK2IJZJENNJVX4TXEZBYVJI.jpg,https://elcomercio.pe/respuestas/farandula/donde-ver-la-final-de-miss-mundo-2024-dia-horario-y-como-seguir-online-via-youtube-desde-la-inidia-yt-lucia-arellano-video-tdpe-noticia/,2024-03-08 22:43:30+00:00,https://elcomercio.pe
"UFC 299 en vivo, ‘Chito’ Vera vs. O’Malley 2 online: fecha, horario, cartelera y en qué canal ver","Sigue la transmisión de la UFC 299, con la pelea entre Sean O’Malley vs. Marlon ‘Chito’ Vera como el principal atractivo.",https://elcomercio.pe/resizer/VCZPjvD7qtGYYThR-20nifynWTg=/cloudfront-us-east-1.images.arcpublishing.com/elcomercio/GGVAY2PWGND3BFFIR5CNZSZCMM.jpg,https://elcomercio.pe/deporte-total/polideportivo/ufc-299-en-vivo-chito-vera-vs-omalley-2-online-gratis-via-espn-fox-sports-premium-fox-sports-star-plus-eurosport-ufc-fight-pass-a-que-hora-es-cartelera-canal-tv-gratis-y-donde-ver-live-streaming-pronostico-apuestas-resultados-video-mx-eeuu-noticia/,2024-03-08 22:41:12+00:00,https://elcomercio.pe
Precio del dólar hoy: cierre a la baja este viernes 8 de marzo,"Precio del dólar hoy EN VIVO: cotización en compra y venta del dólar en el Perú en la jornada de hoy, viernes 8 de marzo. Revisa los movimientos de la moneda estadounidense en el mercado nacional.",https://elcomercio.pe/resizer/KsVwkT86lJ2vgbH1YdAp3TTWaQ8=/cloudfront-us-east-1.images.arcpublishing.com/elcomercio/5ETC5SQ6LFDRFPAZTQGZJWHPKU.jpg,https://elcomercio.pe/economia/mercados/precio-del-dolar-hoy-en-peru-2024-a-cuanto-esta-el-dolar-el-viernes-8-de-marzo-y-tipo-de-cambio-tasa-cotizacion-compra-y-venta-segun-bcr-dolares-a-soles-sbs-ocona-lbposting-noticia/,2024-03-08 22:41:01+00:00,https://elcomercio.pe
"FOX Sports, Chito Vera vs. O’Malley 2 por UFC 299: cómo ver","Sigue la transmisión de la UFC 299, con la pelea entre Sean O’Malley vs. Marlon ‘Chito’ Vera como el principal atractivo.",https://elcomercio.pe/resizer/xs3HnykWOclZr8ciNTxyDQVti_c=/cloudfront-us-east-1.images.arcpublishing.com/elcomercio/DOVOZ2KZPRBHBANUAY6YYO5JUY.jpg,https://elcomercio.pe/deporte-total/polideportivo/fox-sports-premium-chito-vera-vs-omalley-2-en-vivo-por-ufc-299-via-espn-star-plus-eurosport-y-ufc-fight-pass-horario-en-que-canal-y-como-seguir-la-pelea-de-hoy-por-internet-link-streaming-usa-mx-noticia/,2024-03-08 22:39:30+00:00,https://elcomercio.pe
"Alianza Lima vs Sporting Cristal en vivo, Liga 1 Te Apuesto: horario del partido, canal TV gratis y cómo seguir",Alianza Lima vs Sporting Cristal en vivo: partido online gratis por la fecha 7 del Apertura 2024 de la Liga 1 Te Apuesto,https://elcomercio.pe/resizer/dfbSuQJx9z6vGww-RZLxIHxrZOc=/cloudfront-us-east-1.images.arcpublishing.com/elcomercio/2FISSGTFLJEONDKQSFUNSHJPPA.jpg,https://elcomercio.pe/deporte-total/futbol-peruano/alianza-vs-cristal-en-vivo-hoy-via-liga-1-max-directv-claro-dgo-futbol-libre-tv-horario-y-donde-ver-online-gratis-por-apertura-2024-liga-1-te-apuesto-l1ta-noticia/,2024-03-08 22:39:19+00:00,https://elcomercio.pe
"La Marginal de la Selva: la carretera que trae deforestación, narcotráfico y violencia a las puertas del resguardo inga de Yurayaco",,https://elcomercio.pe/resizer/o5od7YvEONChXPtqXl_qz_-3b6Y=/cloudfront-us-east-1.images.arcpublishing.com/elcomercio/P63FV3PWINHRRGU7LZQT5QKIYU.jpg,https://elcomercio.pe/tecnologia/ecologia/la-marginal-de-la-selva-la-carretera-que-trae-deforestacion-narcotrafico-y-violencia-a-las-puertas-del-resguardo-inga-de-yurayaco-noticia/,2024-03-08 22:33:43+00:00,https://elcomercio.pe
Quiniela EN VIVO: conoce los resultados de la nacional y provincia del viernes 8 de marzo,Quiniela EN VIVO hoy resultados Nacional y Provincia: mira aquí los sorteos en sus 5 ediciones y los resultados del viernes 8 de marzo.,https://elcomercio.pe/resizer/SLad71FXuqmVmkOrDLu5f0bk7Xc=/cloudfront-us-east-1.images.arcpublishing.com/elcomercio/4KGEXH2ZKVB7PBI6BYIDQJI7NM.jpg,https://elcomercio.pe/respuestas/argentina/quiniela-en-vivo-resultados-de-hoy-viernes-8-de-marzo-2024-numeros-de-la-nacional-y-provincia-sorteo-nocturna-vespertina-matutina-primera-previa-loteria-de-buenos-aires-argentina-lbposting-ar-noticia/,2024-03-08 22:28:57+00:00,https://elcomercio.pe
Día de la Mujer: las joyas históricas que atestiguan su protagonismo en la historia del Perú,El Archivo General de la Nación resguarda una serie de documentos históricos que reivindican la memoria y acciones de las mujeres en nuestro país. El más antiguo data de 1552. La entidad también conserva la autógrafa de la ley reonoció a las mujeres como ciudadanas con derecho a elegir y ser elegidas.,https://elcomercio.pe/resizer/V1ZfCaY8Iy9wGO8Mbb1sSqYYpeg=/cloudfront-us-east-1.images.arcpublishing.com/elcomercio/HHPZQEA7FVFJ5O2C6GCDLJGQKI.jpeg,https://elcomercio.pe/peru/dia-de-la-mujer-las-joyas-historicas-que-atestiguan-su-protagonismo-en-la-historia-del-peru-fotos-8-de-marzo-noticia/,2024-03-08 22:26:24+00:00,https://elcomercio.pe
A qué hora es el partido Alianza Lima vs Cristal por Liga 1 Te Apuesto,Conoce dónde y a qué hora se puede seguir el partido destacado de la fecha 7 del Torneo Apertura de la Liga 1 Te Apuesto,https://elcomercio.pe/resizer/oMdv4s86nZBD8s99KPuU5ObppaM=/cloudfront-us-east-1.images.arcpublishing.com/elcomercio/BJ4PNV5FMBBNFIYIQUMIXSYTU4.jpg,https://elcomercio.pe/deporte-total/futbol-peruano/a-que-hora-juega-alianza-lima-vs-cristal-y-en-que-canal-como-seguir-partido-por-liga-1-te-apuesto-l1ta-noticia/,2024-03-08 22:18:16+00:00,https://elcomercio.pe
"Liga 1 MAX, link Alianza Lima vs. Sporting Cristal por DirecTV y DGO",Alianza Lima vs. Sporting Cristal por internet: ver partido gratis hoy por la fecha 7 del Torneo Apertura de la Liga 1 Te Apuesto,https://elcomercio.pe/resizer/WzI3oJH2hRkrM0sUOGIjMTUuDJ4=/cloudfront-us-east-1.images.arcpublishing.com/elcomercio/YOGULA6UZJE73BIVFMDO3RXBAI.jpg,https://elcomercio.pe/deporte-total/futbol-peruano/liga-1-max-en-vivo-alianza-lima-vs-sporting-cristal-gratis-hoy-via-futbol-libre-directv-l1-max-dgo-claro-directv-go-video-link-tv-online-y-streaming-liga-1-te-apuesto-l1ta-noticia/,2024-03-08 22:17:42+00:00,https://elcomercio.pe
Victoria ajustada: Barcelona derrotó 1-0 a Mallorca por LaLiga | RESUMEN Y GOL,FC Barcelona se impuso sobre Mallorca por la jornada 28 de LaLiga EA Sports.,https://elcomercio.pe/resizer/-PBRGWMSvNe2eRfjw5s8l9k0kYQ=/cloudfront-us-east-1.images.arcpublishing.com/elcomercio/UGNGJRXHEREF5CDAKWOHQK7DWQ.jpg,https://elcomercio.pe/deporte-total/espana/barcelona-vs-mallorca-en-vivo-directo-gratis-por-dazn-espn-movistar-star-plus-futbol-libre-tv-horarios-canales-de-transmision-y-donde-ver-el-partido-de-laliga-online-alineaciones-apuestas-pronostico-video-es-noticia/,2024-03-08 22:12:09+00:00,https://elcomercio.pe
"RESUMEN, Barcelona 1-0 Mallorca por LaLiga EA Sports | VIDEO",ESPN y DAZN en vivo transmitieron el duelo de Barcelona vs. Mallorca desde el Estadio Olímpico de Montjuïc.,https://elcomercio.pe/resizer/GEqJ3vSB-xudiFoj82YmQRTOZHA=/cloudfront-us-east-1.images.arcpublishing.com/elcomercio/EH2WJP4FN5CVPNRRQSK35O7MDE.jpg,https://elcomercio.pe/deporte-total/espana/espn-y-dazn-en-directo-barcelona-vs-mallorca-online-via-futbol-libre-y-star-plus-gratis-canal-que-televisa-y-como-ver-partido-hoy-por-celular-y-tv-link-hoy-streaming-video-noticia/,2024-03-08 22:12:05+00:00,https://elcomercio.pe
"Mujeres se manifiestan en Caracas por salarios, condiciones laborales y pensiones dignas","Decenas de venezolanas se movilizaron en Caracas este viernes, Día Internacional de la Mujer, para exigir salarios, condiciones laborales y pensiones dignas, además de una mayor participación política.",https://elcomercio.pe/resizer/tQljz91N8nk0JdG6Va5qS9GMujM=/cloudfront-us-east-1.images.arcpublishing.com/elcomercio/4LU6FKKMCJBDJJYYGJO2X73BA4.jpg,https://elcomercio.pe/mundo/venezuela/dia-de-la-mujer-2024-marcha-por-el-8m-8-de-marzo-mujeres-se-manifiestan-en-caracas-por-salarios-condiciones-laborales-y-pensiones-dignas-venezuela-ultimas-noticia/,2024-03-08 22:10:00+00:00,https://elcomercio.pe
Dragon Ball: el curioso homenaje del Cagliari de Gianluca Lapadula al fallecido Akira Toriyama,,https://elcomercio.pe/resizer/1-VeLJivFMFFjp_HmMcN2qPj-HY=/cloudfront-us-east-1.images.arcpublishing.com/elcomercio/ZPE2FOM5VNAINFYU73UVT2N7GM.jpg,https://elcomercio.pe/deporte-total/peruanos-en-el-mundo/dragon-ball-el-curioso-homenaje-del-cagliari-de-gianluca-lapadula-al-fallecido-akira-toriyama-ultimas-noticia/,2024-03-08 22:09:45+00:00,https://elcomercio.pe
"Día de la Mujer: Janet Barboza, Ethel Pozo y Brunella Horna dan mensajes de empoderamiento femenino",Las conductoras del programa “América hoy” compartieron algunas reflexiones por el Día Internacional de la Mujer,https://elcomercio.pe/resizer/R1iyEfzlIrqeodu192ccBWg8vFE=/cloudfront-us-east-1.images.arcpublishing.com/elcomercio/NYATCQB4ERE4JE62GKQA37K22Y.png,https://elcomercio.pe/tvmas/farandula/dia-de-la-mujer-janet-barboza-ethel-pozo-y-brunella-horna-dan-mensajes-de-empoderamiento-femenino-dia-internacional-de-la-mujer-janet-barboza-brunella-horna-ethel-pozo-america-hoy-empoderamiento-femenino-farandula-ultimas-noticia/,2024-03-08 22:07:01+00:00,https://elcomercio.pe
"Ver la Formula 1: GP de Arabia 2024 por internet vía Fox Sports, ESPN y DAZN",GP de Arabia Saudita en vivo: sigue la segunda carrera de la temporada 2024 del Mundial de Fórmula Uno. Conoce todos los detalles del evento,https://elcomercio.pe/resizer/Bndp08Q8Zwxao1ZsbtuhZEQEZMU=/cloudfront-us-east-1.images.arcpublishing.com/elcomercio/EXC6CQBZ4BC7PLQSZZ23AWKZIM.jpg,https://elcomercio.pe/deporte-total/polideportivo/ver-formula-1-gratis-hoy-gp-de-arabia-2024-en-vivo-via-fox-sports-espn-fox-sports-premium-star-plus-gp-saudi-por-dazn-movistar-plus-f1-tv-pro-f-1-online-arabia-saudita-video-link-tv-por-internet-noticia/,2024-03-08 22:06:57+00:00,https://elcomercio.pe
Alianza Lima vs Sporting Cristal hoy: apuestas del partido de la Liga 1 Te Apuesto,,https://elcomercio.pe/resizer/fit8divC8CxAGLq2b-WKTy8Sej0=/cloudfront-us-east-1.images.arcpublishing.com/elcomercio/2AXWYE2P4NA4HOH4WCE7IRL5TA.jpg,https://elcomercio.pe/deporte-total/apuestas-alianza-lima-vs-sporting-cristal-en-vivo-hoy-pronostico-cuotas-online-partido-liga-1-te-apuesto-cuanto-paga-alianza-cristal-en-el-estadio-nacional-barcos-cauteruccio-gol-betsson-inkabet-goles-l1ta-lbposting-noticia/,2024-03-08 22:05:49+00:00,https://elcomercio.pe
"Sorteo Superior: mira aquí la transmisión del sorteo hoy, viernes 8 de marzo","Sorteo Superior EN VIVO hoy viernes 8 de marzo: resultados, números ganadores y premio mayor del sorteo 2799 de la Lotería Nacional de México, que tiene un premio mayor de 17 millones de pesos.",https://elcomercio.pe/resizer/_MKe_7A526Ytj3Oo_0sUs_hoZxQ=/cloudfront-us-east-1.images.arcpublishing.com/elcomercio/TUV2WGW2F5E4LBEBDEKSNAJHJE.jpg,https://elcomercio.pe/respuestas/mexico/sorteo-superior-2799-en-vivo-resultados-hoy-viernes-8-de-marzo-ver-lista-de-premios-y-numeros-ganadores-lotenal-loteria-de-mexico-mx-cdmx-estados-unidos-eeuu-lbposting-noticia/,2024-03-08 22:03:45+00:00,https://elcomercio.pe
GP de Arabia Saudita: horario y dónde ver la Fórmula 1 en directo desde Yeda,GP de Arabia Saudita en vivo: sigue la segunda carrera de la temporada 2024 del Mundial de Fórmula Uno. Conoce todos los detalles del evento,https://elcomercio.pe/resizer/fGtctOlALopJNkqCHd84UFfGquU=/cloudfront-us-east-1.images.arcpublishing.com/elcomercio/Q6NXFWRSJZFY7K7QYEPM2YUWTA.jpg,https://elcomercio.pe/deporte-total/polideportivo/gp-de-arabia-saudita-hoy-f1-en-vivo-formula-1-online-via-espn-directv-fox-sports-premium-star-plus-dazn-movistar-fox-sports-star-plus-dazn-movistar-f1-tv-pro-horario-y-donde-ver-la-formula-uno-noticia/,2024-03-08 22:03:42+00:00,https://elcomercio.pe
"Resultados | Sorteo Superior hoy, viernes 8 de marzo: números y tabla de premios","Sorteo Superior EN VIVO hoy viernes 8 de marzo: resultados, números ganadores y premio mayor del sorteo 2799 de la Lotería Nacional de México, que tiene un premio mayor de 17 millones de pesos.",https://elcomercio.pe/resizer/Tu-CLBDLk3s9vuljI961YWqKBho=/cloudfront-us-east-1.images.arcpublishing.com/elcomercio/QCEDMR4JGBGYJENPTVAGB3J3KE.jpeg,https://elcomercio.pe/respuestas/mexico/resultados-sorteo-superior-2799-en-vivo-premio-mayor-de-hoy-viernes-8-de-marzo-ver-lista-y-numeros-ganadores-lotenal-loteria-de-mexico-mx-cdmx-estados-unidos-eeuu-lbposting-noticia/,2024-03-08 22:03:35+00:00,https://elcomercio.pe
"“Hoy, en el Perú es mucho más normal ir a una cancha y ver chicas jugando fútbol” | ENTREVISTA",La goleadora de Alianza Lima Femenino conversó con DT El Comercio en el Día de la Mujer y analizó el presente del fútbol femenino en el país.,https://elcomercio.pe/resizer/uwDU9GIttumy1byGYqeCPoWvqJY=/cloudfront-us-east-1.images.arcpublishing.com/elcomercio/7JLOEU4VYNFJNLK2WBK3VZVZHE.jpg,https://elcomercio.pe/deporte-total/futbol-peruano/adriana-lucar-sobre-futbol-femenino-en-peru-hoy-es-mucho-mas-normal-ir-a-una-cancha-y-ver-chicas-jugando-futbol-alianza-lima-femenino-liga-femenina-seleccion-peruana-femenina-dia-de-la-mujer-noticia/,2024-03-08 22:02:00+00:00,https://elcomercio.pe
"Paolo Guerrero, Vallejo y una clasificación que lo acerca a un nuevo récord en su carrera | CRÓNICA","Le anularon un gol que pudo acercarlo a un récord, pero Paolo Guerrero tendrá al menos seis partidos para buscar un registro en el fútbol peruano. César Vallejo venció 2-0 a Sport Huancayo y avanzó a la fase de grupos de la Copa Sudamericana.",https://elcomercio.pe/resizer/nyE1XTFYit62J1hA6GPmZWYEMKI=/cloudfront-us-east-1.images.arcpublishing.com/elcomercio/Q7XUKNEDOJFRXD2GGAG3YLA5ZM.jpg,https://elcomercio.pe/deporte-total/futbol-peruano/paolo-guerrero-y-una-clasificacion-en-copa-sudamericana-que-lo-acerca-a-un-nuevo-record-en-su-carrera-cesar-vallejo-vs-huancayo-gol-anulado-guerrero-noticia/,2024-03-08 22:02:00+00:00,https://elcomercio.pe
"Horóscopo de hoy, viernes 8 de marzo: pronósticos según tu signo zodiacal","Horóscopo de hoy viernes 8 de marzo: Conoce lo que te deparan las estrellas en el trabajo, negocio y amor, según los signos del zodiaco. | Cuántos signos zodiacales hay | Horóscopo de hoy Trome | Signos que nacieron para ser millonarios | Cuál es el signo más peligroso | Cuál es el signo más inteligente | Los signos más celosos | Cómo son los géminis",https://elcomercio.pe/resizer/yT6hF8YbLmZq9nDKqXS31F0edGY=/cloudfront-us-east-1.images.arcpublishing.com/elcomercio/65T2OZIEQRCO3MJXDPPFHDYG5I.jpg,https://elcomercio.pe/luces/vida-social/horoscopo-de-hoy-en-vivo-y-predicciones-gratis-viernes-8-de-marzo-2024-segun-tu-signo-zodiacal-aries-tauro-geminis-cancer-leo-virgo-libra-escorpio-sagitario-capricornio-acuario-piscis-lbposting-noticia/,2024-03-08 22:00:00+00:00,https://elcomercio.pe
"Roshi, Cell y Krilin: los nombres de los peruanos inspirados en ‘Dragon Ball’","Tras la muerte de Akira Toriyama, el Reniec publicó un listado de nombres inusuales de peruanos vinculados a la serie ‘Dragon Ball’. Existen en el Perú 292 personas que se llaman Gohan, siete Goku, cinco Vegueta y más. Mira aquí la lista completa.",,https://elcomercio.pe/videos/pais/roshi-cell-y-krilin-los-nombres-de-los-peruanos-inspirados-en-dragon-ball-viral-akira-toriyama-nnav-video-latv-noticia/,2024-03-08 21:58:50+00:00,https://elcomercio.pe
Mimy Succar se junta con Gloria Estefan y Sheila E. para estrenar cover de “Bemba colorá”,La artista peruana interpretará un clásico de Celia Cruz en el contexto de la conmemoración por el Día Internacional de la Mujer,https://elcomercio.pe/resizer/t6TS-oC7BwYCXm1SXOABzLLGh9k=/cloudfront-us-east-1.images.arcpublishing.com/elcomercio/TQ22WTDYVZAU3G4VXZNU5W6HBU.png,https://elcomercio.pe/luces/musica/mimy-succar-se-junta-con-gloria-estefan-y-sheila-e-para-estrenar-cover-de-bemba-colora-mimy-succar-gloria-estefan-sheila-e-bemba-colora-musica-luces-ultimas-noticia/,2024-03-08 21:53:37+00:00,https://elcomercio.pe
JNJ: ¿Quiénes son los accesitarios habilitados para reemplazar a Inés Tello y Aldo Vásquez?,,https://elcomercio.pe/resizer/HVXdjifhlP8BcPLYy2V_H7UFmtY=/cloudfront-us-east-1.images.arcpublishing.com/elcomercio/VRO32NAJOFG5JHBVORNLRGWZDA.png,https://elcomercio.pe/politica/actualidad/jnj-quienes-son-los-accesitarios-llamados-a-reemplazar-a-ines-tello-y-aldo-vasquez-perfiles-congreso-junta-nacional-de-justicia-noticia/,2024-03-08 21:50:00+00:00,https://elcomercio.pe
Universitario vs. Garcilaso EN VIVO vía Liga 1 MAX: se enfrentan en Cusco por el Torneo Apertura 2024,"Sigue las incidencias del <a href=""https://rpp.pe/noticias/universitario-de-deportes"" rel=""noopener"" target=""_blank""><strong>Universitario</strong></a> contra <a href=""https://rpp.pe/futbol/descentralizado/liga-1-se-enfrentan-deportivo-garcilaso-y-universitario-por-la-fecha-7-noticia-1539443"" rel=""noopener"" target=""_blank""><strong>Deportivo Garcilaso</strong></a> por la fecha 7 de la <strong>Liga 1 Te Apuesto</strong>. Los cremas quieren seguir en la cima del Apertura.",https://e.rpp-noticias.io/normal/2024/03/07/364736_1549334.webp,https://rpp.pe/futbol/descentralizado/universitario-vs-deportivo-garcilaso-via-liga-1-max-en-vivo-ver-online-en-directo-transmision-en-cusco-por-fecha-7-del-torneo-apertura-2024-noticia-1539485,2024-03-09 01:00:21+00:00,https://rpp.pe
¿A qué hora juega Alianza Lima vs. Sporting Cristal por el Torneo Apertura de la Liga 1 2024?,"<strong><a href=""https://rpp.pe/noticias/alianza-lima?ref=rpp"">Alianza Lima</a> </strong>y<strong> <a href=""https://rpp.pe/noticias/sporting-cristal?ref=rpp"">Sporting Cristal</a> </strong>se enfrentan este sábado por la fecha 7 de <strong>Liga 1 Te Apuesto</strong>. Entérate a qué hora juegan y por dónde ver el partido.",https://e.rpp-noticias.io/normal/2024/03/07/114211_1549135.webp,https://rpp.pe/futbol/descentralizado/a-que-hora-juega-alianza-lima-vs-sporting-cristal-en-directo-por-el-torneo-apertura-2024-noticia-1538720,2024-03-09 00:45:01+00:00,https://rpp.pe
¿A qué hora juega Universitario vs. Garcilaso EN VIVO por la fecha 7 del Torneo Apertura 2024?,"Revisa la programación del <a href=""https://rpp.pe/noticias/universitario-de-deportes""><strong>Universitario de Deportes</strong></a> ante <strong>Deportivo Garcilaso</strong>, partido por la sétima fecha del <strong>Torneo Apertura</strong> en la <a href=""https://rpp.pe/noticias/liga-1?ref=rpp""><strong>Liga 1 Te Apuesto 2024</strong></a>.",https://e.rpp-noticias.io/normal/2024/03/06/481948_1548817.webp,https://rpp.pe/futbol/descentralizado/a-que-hora-juega-universitario-vs-garcilaso-en-vivo-liga-1-te-apuesto-fecha-7-apertura-2024-noticia-1539194,2024-03-09 00:00:43+00:00,https://rpp.pe
Mannucci vs. Los Chankas: ¿A qué hora juegan y dónde ver el partido por la fecha 7 de Liga 1?,"Sigue las incidencias del partido entre <strong>Carlos A. Mannucci</strong> y <a href=""https://rpp.pe/noticias/los-chankas""><strong>Los Chankas</strong></a>, partido por la fecha 7 del Apertura de la <a href=""https://rpp.pe/noticias/liga-1?ref=rpp""><strong>Liga 1.</strong></a>",https://e.rpp-noticias.io/normal/2024/03/08/233423_1549929.webp,https://rpp.pe/futbol/descentralizado/mannucci-vs-los-chankas-en-vivo-golperu-ver-liga-1-2024-online-link-gratis-apertura-fecha-7-trujillo-noticia-1539796,2024-03-08 23:35:34+00:00,https://rpp.pe
Volodomir Zelenski asegura que Rusia ha intentado matarlo en más de diez ocasiones,"El presidente de <a href=""https://rpp.pe/noticias/ucrania"">Ucrania</a> insistió en la necesidad de que a su país le suministren sistemas de misiles de largo alcance para enfrentar a <strong>Rusia. </strong>",https://e.rpp-noticias.io/normal/2024/03/08/490649_1549993.webp,https://rpp.pe/mundo/rusia/volodomir-zelenski-asegura-que-rusia-ha-intentado-matarlo-en-mas-de-diez-ocasiones-noticia-1539815,2024-03-08 23:10:22+00:00,https://rpp.pe
Y no fue ni amarilla: el durísimo planchazo a Lionel Messi en la Copa de Campeones de la Concacaf [VIDEO],"<a href=""https://rpp.pe/noticias/lionel-messi"" rel=""noopener"" target=""_blank""><strong>Lionel Messi</strong></a> sufrió una fuerte falta de parte de Lukas MacNaughton en el partido de<a href=""https://rpp.pe/noticias/inter-miami"" rel=""noopener"" target=""_blank""> <strong>Inter Miami</strong></a> contra <strong>Nashville SC</strong>.",https://e.rpp-noticias.io/normal/2024/03/08/493849_1549985.webp,https://rpp.pe/futbol/futbol-mundial/lionel-messi-recibio-durisimo-planchazo-de-lukas-macnaughton-que-no-fue-ni-tarjeta-amarilla-video-noticia-1539811,2024-03-08 23:03:35+00:00,https://rpp.pe
Miles de argentinas marchan contra las medidas antifeministas y la 'motosierra' de Javier Milei,"Las manifestantes protestaron por mantener el derecho al<strong> aborto</strong> y contra la <strong>violencia machista</strong>, la trata de personas y los ajustes económicos que lleva adelante el <a href=""https://rpp.pe/noticias/argentina"">mandatario ultraderechista</a>.",https://e.rpp-noticias.io/normal/2024/03/08/444744_1549990.webp,https://rpp.pe/mundo/latinoamerica/javier-milei-miles-de-argentinas-marchan-contra-la-motosierra-del-presidente-noticia-1539820,2024-03-08 22:59:27+00:00,https://rpp.pe
