title,description,image_url,original_url,created_at,website
Audios y videos filtrados: Más de 10 casos que remecieron a altas autoridades en Perú,"La renuncia de Alberto Otárola a la Presidencia del Consejo de Ministros por un audio trae a la memoria más de 10 casos en la historia más reciente del país, que comenzó con los ‘vladivideos’ en el 2000.",https://elcomercio.pe/resizer/RkKKJJ0d2isi5sghSLFsVDCTqcQ=/cloudfront-us-east-1.images.arcpublishing.com/elcomercio/N577PFDQIBENXEOLILIOEWCBNE.jpg,https://elcomercio.pe/politica/gobierno/audios-y-videos-filtrados-mas-de-10-casos-que-remecieron-a-altas-autoridades-en-peru-vladivideos-petroaudios-alberto-otarola-noticia/,2024-03-12 00:42:00+00:00,https://elcomercio.pe
Magaly TV La Firme 2024 EN VIVO: A qué hora inicia y cómo seguir el programa de hoy,"Sigue, Magaly TV La Firme EN VIVO vía ATV: Ver transmisión del programa de hoy",https://elcomercio.pe/resizer/Gx5tig-O6LY0B7R8eYJQLuUmCl8=/cloudfront-us-east-1.images.arcpublishing.com/elcomercio/LSWMB7SOEVF6RIS2NF44AAFTCA.png,https://elcomercio.pe/respuestas/farandula/magaly-tv-la-firme-hoy-en-vivo-a-que-hora-se-transmite-y-por-que-canal-ver-el-programa-via-atv-en-directo-online-magaly-medina-ampay-video-youtube-tdpe-noticia/,2024-03-12 00:41:53+00:00,https://elcomercio.pe
Murió cómico ambulante “Care Chancho” a los 64 años | VIDEO,El humorista peruano se encontraba delicado de salud desde hace años. La noticia de su muerte fue confirmada por su hijo esta tarde.,https://elcomercio.pe/resizer/oZi5IhzXx_L-1qRNLlJwxc3h5qw=/cloudfront-us-east-1.images.arcpublishing.com/elcomercio/KMLRDOBXZBCA7BPXKV4WOCZ6OQ.png,https://elcomercio.pe/tvmas/farandula/care-chancho-popular-comico-ambulante-murio-a-los-64-anos-ultimas-noticia/,2024-03-12 00:41:34+00:00,https://elcomercio.pe
Cuál fue la sustancial suma que ganó Paolo Guerrero al clasificar a la Copa Sudamericana con UCV,Cuál fue la sustancial suma que ganó Paolo Guerrero al clasificar con UCV a la Copa Sudamericana | En la siguiente nota te contaremos todo lo que debes saber sobre este tema que ha llamado la atención de los fanáticos del club y del ‘depredador’.,https://elcomercio.pe/resizer/M7vTrTy5JO2XMdbxeoTwLuubs7w=/cloudfront-us-east-1.images.arcpublishing.com/elcomercio/TDRJBNTYPRF4XAX6VGPX4DMBMI.jpeg,https://elcomercio.pe/respuestas/deportes/cual-fue-la-sustancial-suma-que-gano-paolo-guerreo-al-clasificar-con-ucv-a-la-copa-sudamericana-tdpe-noticia/,2024-03-12 00:37:40+00:00,https://elcomercio.pe
¿Cómo saber cuánto dinero he acumulado en mi AFP?,¿Quieres saber cuánto acumulas en tu AFP hasta la actualidad? Descubre en unos sencillos pasos,https://elcomercio.pe/resizer/nYdC1iyQo517Glq2V5V54qnVKtA=/cloudfront-us-east-1.images.arcpublishing.com/elcomercio/JZKU7DE2EVCSRFUNHK6ZSNVHNI.jpg,https://elcomercio.pe/respuestas/como/consulta-el-saldo-de-tu-fondo-de-pensiones-en-tu-afp-con-estos-pasos-dni-link-retiro-afp-tdpe-noticia/,2024-03-12 00:35:47+00:00,https://elcomercio.pe
"Cuánto es el sueldo mínimo docente 2024 y la nueva escala salarial, propuesta por Minedu",Consulta en la siguiente nota la escala salarial para profesores nombrados y contratados en Perú.,https://elcomercio.pe/resizer/SOZimqD0wrOXrqyQo79aQiziAfs=/cloudfront-us-east-1.images.arcpublishing.com/elcomercio/SSJRVI2COFCVNENB5COORAQVXY.jpg,https://elcomercio.pe/respuestas/cuando/cuanto-ganan-los-maestros-del-peru-en-el-2024-revisa-la-escala-salarial-segun-minedu-contratados-y-nombrados-tdpe-noticia/,2024-03-12 00:34:55+00:00,https://elcomercio.pe
Aumento de Sueldo mínimo 2024 en Perú: ¿Qué ha anunciado el Ejecutivo sobre la medida?,¿Habrá un incremento salarial para el 2024? Consulta los últimos anuncios que ha dado el Gobierno sobre el sueldo mínimo.,https://elcomercio.pe/resizer/VmjBnqTrtF8t0gpcCHSBdvEYSwQ=/cloudfront-us-east-1.images.arcpublishing.com/elcomercio/NRYSOJACKNA3DETGYC2HGBWCZU.png,https://elcomercio.pe/respuestas/sueldo-minimo-en-peru-2024-cual-es-el-monto-actual-y-cuando-se-daria-un-aumento-ejecutivo-dina-boluarte-remuneracion-minima-vital-tdpe-noticia/,2024-03-12 00:34:22+00:00,https://elcomercio.pe
Pago Fonavi 2024: ¿Qué se ha anunciado del posible desembolso en marzo?,"Consulta en la siguiente nota qué se sabe sobre la devolución del Fonavi en marzo 2024, listas de beneficiarios, fechas y más.",https://elcomercio.pe/resizer/rSPkK62POnJETIOxJ1I9cKq4TW4=/cloudfront-us-east-1.images.arcpublishing.com/elcomercio/JOYJXHGZGBCKBEYJJDEXIRT3AU.png,https://elcomercio.pe/respuestas/tramites/pago-de-fonavi-2024-que-se-ha-anunciado-sobre-el-postible-desembolso-en-marzo-link-consultas-con-dni-banco-de-la-nacion-gobpe-tdpe-noticia/,2024-03-12 00:33:38+00:00,https://elcomercio.pe
Nicolás Maduro elegido por el chavismo para buscar un tercer mandato en Venezuela,"El presidente de Venezuela, Nicolás Maduro, fue electo por su partido para buscar un tercer mandato consecutivo en las elecciones del 28 de julio, mientras la oposición está contra las cuerdas para definir un candidato.",https://elcomercio.pe/resizer/DEjhNpBM1kD4C65KmIBmbUKPpgw=/cloudfront-us-east-1.images.arcpublishing.com/elcomercio/XV6RQ2TVKBGCNECNKYN25XMTGA.jpg,https://elcomercio.pe/mundo/venezuela/nicolas-maduro-elegido-por-el-chavismo-para-buscar-un-tercer-mandato-elecciones-en-venezuela-psuv-diosdado-cabello-maria-corina-machado-pud-noruega-barbados-ultimas-noticia/,2024-03-12 00:31:41+00:00,https://elcomercio.pe
"Horóscopo de hoy, lunes 11 de marzo: cómo te irá en el trabajo y amor, según tu signo zodiacal","Horóscopo de hoy lunes 11 de marzo: Conoce lo que te deparan las estrellas en el trabajo, negocio y amor, según los signos del zodiaco. | Cuántos signos zodiacales hay | Horóscopo de hoy Trome | Signos que nacieron para ser millonarios | Cuál es el signo más peligroso | Cuál es el signo más inteligente | Los signos más celosos | Cómo son los géminis",https://elcomercio.pe/resizer/EfdWUHzz1TSbq-cDM0qi1CAQthE=/cloudfront-us-east-1.images.arcpublishing.com/elcomercio/2XVKES6OKFGQ7HRAVLKSEU7AYI.jpg,https://elcomercio.pe/luces/vida-social/horoscopo-en-vivo-y-predicciones-gratis-segun-tu-signo-zodiacal-del-lunes-11-de-marzo-aries-tauro-geminis-cancer-leo-virgo-libra-escorpio-sagitario-capricornio-acuario-piscis-lbposting-noticia/,2024-03-12 00:30:00+00:00,https://elcomercio.pe
¿Qué pidieron los mineros que marcharon hoy en Lima?,Este lunes se dio una marcha de mineros artesanales en el país pidiendo que se cumpla el plazo de registro en el Reinfo hasta el 31 de diciembre de 2024 y se derogue la disposición del decreto ley que acorta la fecha hasta el 20 de mayo. Ampliación de plazo no trataría los problemas que ha tenido este proceso.,https://elcomercio.pe/resizer/EfAyC79dsX933h5IPR0Z2Sk6sGY=/cloudfront-us-east-1.images.arcpublishing.com/elcomercio/5MGBYXWR6NHJ7PACW7Q2N4CTAE.jpeg,https://elcomercio.pe/economia/mineria-artesanal-que-pidieron-los-mineros-que-marcharon-hoy-en-lima-noticia/,2024-03-12 00:25:34+00:00,https://elcomercio.pe
"Congreso aprobó interpelar a los ministros del Interior, Cultura y Transportes y Comunicaciones","El pleno del Congreso de la República aprobó este lunes, 11 de marzo, mociones de interpelaciones a los ministros del Interior, Víctor Torres; de Transportes y Comunicaciones, Raúl Pérez Reyes, y de Cultura, Leslie Urteaga.",https://elcomercio.pe/resizer/C7zgDWCDDfgMVyyYPiRlcoPI5Nk=/cloudfront-us-east-1.images.arcpublishing.com/elcomercio/NU4P73N4LRBWDPENQMHEQ6C6RQ.jfif,https://elcomercio.pe/politica/congreso/congreso-aprobo-este-lunes-interpelar-a-los-ministros-de-interior-cultura-y-transportes-y-comunicaciones-leslie-urteaga-victor-torres-raul-perez-reyes-gobierno-ultima-noticia/,2024-03-12 00:21:39+00:00,https://elcomercio.pe
"Hoy, Powerball ONLINE: mira aquí los resultados y sorteo EN VIVO del lunes 11 de marzo",Powerball EN VIVO ONLINE del lunes 11 de marzo de 2024: revisa aquí los resultados de la lotería más popular de Estados Unidos. También sigue el sorteo y los números ganadores del Double Play.,https://elcomercio.pe/resizer/sQpG_fGQSvc1DlBd1DSbypzy9dc=/cloudfront-us-east-1.images.arcpublishing.com/elcomercio/32BWN2CIAFGAJDM36RAIPQXWKI.jpg,https://elcomercio.pe/respuestas/usa/powerball-online-en-vivo-resultados-de-hoy-lunes-11-de-marzo-2024-ver-numeros-ganadores-y-jackpot-winning-numbers-mega-millions-cash-value-double-play-washington-eeuu-usa-lbposting-noticia/,2024-03-12 00:18:36+00:00,https://elcomercio.pe
Calendario 2024 de COLOMBIA con días festivos del año,Consulta en la siguiente nota el calendario oficial con los días festivos y puentes del año 2024.,https://elcomercio.pe/resizer/w_ffpi2GSmNrKqAKtnmRZxnFIw8=/cloudfront-us-east-1.images.arcpublishing.com/elcomercio/DAAX7NQ65JHHLA4F326TQ6Q7HM.png,https://elcomercio.pe/respuestas/colombia/calendario-2024-de-colombia-con-proximos-festivos-y-puentes-del-ano-festivos-2024-en-colombia-feriados-y-dias-libres-tdex-noticia/,2024-03-12 00:15:50+00:00,https://elcomercio.pe
Así fueron los atentados yihadistas del 11-M que dejaron 192 muertos en España hace 20 años,"Se cumplen 20 años de los atentados del 11 de marzo del 2004 en Madrid, que dejaron 192 muertos y más de 1.800 heridos. En esta nota te contamos cómo fue el peor ataque yihadista en la historia de España",https://elcomercio.pe/resizer/jKEAILDkSN0HMX6GgAn___8nawE=/cloudfront-us-east-1.images.arcpublishing.com/elcomercio/JMJR2KYAZBCDTEEUXLEZP6SSSQ.jpg,https://elcomercio.pe/mundo/espana/20-anos-del-11-m-en-madrid-atocha-como-fueron-los-atentados-terroristas-de-al-qaeda-del-11-de-marzo-del-2004-en-espana-que-dejaron-192-muertos-por-que-al-qaeda-ataco-en-espana-noticia/,2024-03-12 00:12:53+00:00,https://elcomercio.pe
La nueva bomba guiada de Rusia que causa devastación y fuertes bajas en el frente de guerra de Ucrania,Rusia ha actualizado las bombas FAB-1500 para incrementar su capacidad destructiva. Esta arma de la era soviética ahora es guiada y tiene un sistema de planeo que la convierte en altamente letal,https://elcomercio.pe/resizer/wHi9u_r5QeGtGY4H95ejAtyzrdY=/cloudfront-us-east-1.images.arcpublishing.com/elcomercio/PBXMLDKBNNFM5BKCJLBFJI26WQ.jpg,https://elcomercio.pe/mundo/europa/guerra-rusia-ucrania-fab-1500-como-es-la-nueva-bomba-guiada-que-rusia-esta-usando-en-ucrania-e-inflige-devastacion-y-fuertes-bajas-en-las-lineas-del-frente-vladimir-putin-volodymyr-zelensky-noticia/,2024-03-12 00:12:32+00:00,https://elcomercio.pe
La Tinka: conoce el resultado del sorteo realizado el 10/03/24,"¿Te la perdiste? Conoce los resultados que podrían cambiarte la vida jugando La Tinka. La lotería se desarrolló bajo la presencia de la Dra. Loudelvi Yáñez Aspilcueta, notaria pública de Lima.",,https://elcomercio.pe/videos/entretenimiento/la-tinka-descubre-los-resultados-del-sorteo-realizado-el-10032024-sorteo-resultado-ganadores-loteria-si-o-si-nnav-video-amtv-noticia/,2024-03-12 00:11:00+00:00,https://elcomercio.pe
Ariel Henry permanece en Puerto Rico y no participa de la reunión de Caricom sobre Haití,"El primer ministro haitiano, Ariel Henry, no acudió este lunes a la reunión en Jamaica convocada por la Comunidad del Caribe (Caricom) para tratar de hallar una solución a la crisis en Haití, y permanece en Puerto Rico.",https://elcomercio.pe/resizer/1EEvluBUS2Uvl_DsfUBQpkOjWcI=/cloudfront-us-east-1.images.arcpublishing.com/elcomercio/GILZUDOBZBDQBJDC3SBESC24LQ.jpg,https://elcomercio.pe/mundo/centroamerica/haiti-ariel-henry-permanece-en-puerto-rico-y-no-participa-de-la-reunion-de-caricom-sobre-puerto-principe-jamaica-kingston-barbecue-jimmy-cherizier-onu-antony-blinken-ultimas-noticia/,2024-03-12 00:03:35+00:00,https://elcomercio.pe
"Partidos de hoy, martes 12 de marzo: a qué hora juegan y en qué canales ver fútbol en vivo","Revisa la programación completa de todos los partidos de hoy, martes 12 de marzo del año 2024",https://elcomercio.pe/resizer/TungoHhffTreEENwOOnN7cMPse8=/cloudfront-us-east-1.images.arcpublishing.com/elcomercio/O2NPNBTMVVFRHDQQEYIVXOCCTY.jpg,https://elcomercio.pe/deporte-total/futbol-mundial/partidos-de-hoy-marzo-12-2024-martes-futbol-en-vivo-programacion-tv-streaming-horarios-canales-donde-ver-y-resultados-apuestas-del-dia-pronosticos-noticia/,2024-03-12 00:00:00+00:00,https://elcomercio.pe
Nelly Rossinelli comparte sus recetas de loncheras saludables en esta vuelta a clases,Antes de “El graf chef: Famosos” estuvo la fama del TikTok. La hoy jueza del ‘reality’ comparte con Somos los motivos que la llevaron a grabarse preparando opciones saludables para enviar a sus hijos al colegio,https://elcomercio.pe/resizer/pVkPje91pHEs1ZegDVynK8iD_Aw=/cloudfront-us-east-1.images.arcpublishing.com/elcomercio/KQP4JVYWWVESVO6KIXPLKMN6WA.JPG,https://elcomercio.pe/somos/estilo/nelly-rossinelli-comparte-sus-recetas-de-loncheras-saludables-en-esta-vuelta-a-clases-el-gran-chef-famosos-regreso-a-clases-verano-marzo-colegios-comida-historias-ec-noticia/,2024-03-11 23:58:00+00:00,https://elcomercio.pe
Advierten que masificación del gas natural estaría en riesgo si Congreso limita alcance de la tarifa nivelada para regiones,"La Sociedad Peruana de Hidrocarburos (SPH) advirtió que la masificación del gas natural en el Perú está en riesgo si la Comisión de Energía y Minas del Congreso aprueba, en su próxima sesión, la ley que crea una tarifa nivelada de gas natural sin incluir a la totalidad del mercado regulado (clientes que consumen menos de 900,000 m3 por mes), que son los clientes ancla que dan sostenibilidad a las concesiones.",https://elcomercio.pe/resizer/clrExv48TpAWqE4B9qmSd6Nopcg=/cloudfront-us-east-1.images.arcpublishing.com/elcomercio/R34TGWH6YZH2JJWA2W3Z6NQLPM.jpg,https://elcomercio.pe/economia/peru/sociedad-peruana-de-hidrocarburos-advierten-que-masificacion-del-gas-natural-en-el-pais-estaria-en-riesgo-si-congreso-limita-alcance-de-la-tarifa-nivelada-para-regiones-comision-de-energia-y-minas-sph-ultimas-noticia/,2024-03-11 23:56:08+00:00,https://elcomercio.pe
Bad Bunny: así lució el reggaetonero en su debut en el Oscar 2024,"La estrella urbana continúa destacándose en los eventos más importantes de la industria del entretenimiento. Esta vez, fue invitado a presentar uno de los trofeos del Oscar 2024. Aquí las mejores imágenes de su paso por la ceremonia.",,https://elcomercio.pe/saltar-intro/noticias/bad-bunny-en-los-premios-oscar-2024-mira-el-look-del-cantante-puertorriqueno-fotos-noticia/,2024-03-11 23:56:00+00:00,https://elcomercio.pe
"Último temblor en México hoy, 11 de marzo según SSN: Dónde fue el epicentro y magnitud del sismo",Consulta el reporte de sismos ocurridos en la CDMX según el Servicio Sismológico Nacional (SSN).,https://elcomercio.pe/resizer/U31TxZc1SC0yHug4W6Z_AZgaVP4=/cloudfront-us-east-1.images.arcpublishing.com/elcomercio/PPY66SUSPBDX7O3TR3KIVU6PDM.png,https://elcomercio.pe/respuestas/mexico/ultimo-temblor-en-mexico-hoy-segun-ssn-donde-fue-el-epicentro-hora-y-magnitud-profundidad-reportes-del-ssn-sismos-en-mexico-cdmx-video-tdex-noticia/,2024-03-11 23:56:00+00:00,https://elcomercio.pe
Melissa Klug y Jesús Barco reconciliados: festejan cumpleaños de futbolista,Melissa Klug y Jesús Barco se habrían reconciliado tras un mes de anunciar su separación vía redes sociales. La empresaria festejó los 27 años del mediocampista de Sport Boys y dedicó palabras de agradecimiento al padre de su última hija.,,https://elcomercio.pe/videos/entretenimiento/melissa-klug-y-jesus-barco-reconciliados-festejan-cumpleanos-de-futbolista-farandula-nnav-amtv-video-noticia/,2024-03-11 23:55:00+00:00,https://elcomercio.pe
¿Se reconciliaron? Christian Cueva y Pamela López fugaron al norte del país | VIDEO,Las cámaras de “Amor y fuego” captaron a la parejita huyendo al norte del país tras el escándalo de infidelidad del futbolista.,https://elcomercio.pe/resizer/-hljgdLOm_WUmHoSPuA1IKGNNME=/cloudfront-us-east-1.images.arcpublishing.com/elcomercio/7BGULV4ZXFEC5P6WGCUH22TYKI.png,https://elcomercio.pe/tvmas/farandula/christian-cueva-y-pamela-lopez-fugaron-al-norte-del-pais-en-camioneta-del-futbolista-ultimas-noticia/,2024-03-11 23:48:51+00:00,https://elcomercio.pe
Defensa de Patricia Benavides rechaza acusación fiscal sobre coordinaciones con fuerzas políticas: “Es una ligereza poco profesional”,,https://elcomercio.pe/resizer/4QyvtvfaB134V3JdHJ7tJo3MUSE=/cloudfront-us-east-1.images.arcpublishing.com/elcomercio/LVEQ6QTU6VCAFB5MMLKL3GV2VY.png,https://elcomercio.pe/politica/justicia/defensa-de-patricia-benavides-rechaza-fiscal-acusacion-sobre-coordinaciones-con-fuerzas-politicas-es-una-ligereza-poco-profesional-noticia/,2024-03-11 23:45:16+00:00,https://elcomercio.pe
Resultados de Examen de Admisión San Marcos 2024-II: Lista de ingresantes del 9 y 10 de marzo,¡Atención postulante! Si rendiste tu examen en la Decana de América este 9 y 10 de marzo ya puedes conocer los resultados en el LINK actualizado de la página oficial.,https://elcomercio.pe/resizer/HDbYYt2UtlYhe6m-o0ZyeIKCPB8=/cloudfront-us-east-1.images.arcpublishing.com/elcomercio/ABXHVYFIB5GKZH7T6SU27USWQQ.png,https://elcomercio.pe/respuestas/estudios-carreras/examen-de-admision-san-marcos-2024-ii-resultados-puntajes-y-lista-de-ingresantes-link-oca-unmsm-tdpe-noticia/,2024-03-11 23:44:54+00:00,https://elcomercio.pe
Últimas noticias de los resultados del examen de UNMSM,¡Atención postulante! Si rendiste tu examen en la Decana de América este 9 y 10 de marzo ya puedes conocer los resultados en el LINK actualizado de la página oficial.,https://elcomercio.pe/resizer/ZVBfs0Epq8WfLKZuhLM_IJpoTwo=/cloudfront-us-east-1.images.arcpublishing.com/elcomercio/N3EHMQXLNZBE3CUG2YRLDQEYKE.png,https://elcomercio.pe/respuestas/estudios-carreras/resultados-del-examen-de-admision-2024-ii-de-unmsm-link-de-consulta-para-saber-si-alcanzaste-una-vacante-oca-admision-2024-san-marcos-tdpe-noticia/,2024-03-10 23:10:00+00:00,https://elcomercio.pe
Alondra García Miró recuerda a su madre en entrevista: “Ella murió durmiendo en mi cama” | VIDEO,La empresaria contó que su madre falleció de manera inesperada y que antes de lo sucedido solo había presentado dolor de cabeza.,https://elcomercio.pe/resizer/-0nlQKWHqIIAXOKwPH1wjAh8Pn0=/cloudfront-us-east-1.images.arcpublishing.com/elcomercio/HSTN3GVA5VBV5GSOKJ23ZOELFY.png,https://elcomercio.pe/tvmas/farandula/alondra-garcia-miro-recuerda-a-su-madre-en-entrevista-ella-murio-durmiendo-en-mi-cama-ultimas-noticia/,2024-03-11 23:41:57+00:00,https://elcomercio.pe
"Los Intocables de la Corrupción: Exministro de Martín Vizcarra bloqueó procesos de control en Provías Nacional, según testigo","No solo los exministros de Transportes y Comunicaciones Edmer Trujillo y Carlos Estremadoyro han sido implicados por testigos y colaboradores eficaces en la trama de “Los Intocables de la Corrupción”, presunta red criminal que habría encabezado el expresidente Martín Vizcarra, sino también Carlos Lozada, quien fue titular de Vivienda, Construcción y Saneamiento en la recta final del gobierno vizcarrista.",https://elcomercio.pe/resizer/O2QIH4P7zNZu0WfOXw8Tnk7DE_w=/cloudfront-us-east-1.images.arcpublishing.com/elcomercio/JRCNBS3GRZBPJCUGRQLZPVFW6Q.png,https://elcomercio.pe/politica/justicia/exministro-carlos-lozada-bloqueo-procesos-de-control-en-provias-nacional-segun-testigo-noticia/,2024-03-11 23:41:54+00:00,https://elcomercio.pe
Fiscalía asistió al Estadio Nacional en el Alianza Lima vs. Sporting Cristal y decomisó bebidas alcohólicas,Las autoridades encontraron a un grupo de jóvenes que dieron positivos en la prueba de alcoholemia.,https://elcomercio.pe/resizer/eFXedOhlaXcyRfLeT4rC03JHORY=/cloudfront-us-east-1.images.arcpublishing.com/elcomercio/XQDWH466E5C4HHHW23GVRZZFSU.jpg,https://elcomercio.pe/deporte-total/futbol-peruano/fiscalia-asistio-al-estadio-nacional-en-el-alianza-lima-vs-sporting-cristal-y-decomiso-bebidas-alcoholicas-liga-1-te-apuesto-l1ta-noticia/,2024-03-11 23:41:00+00:00,https://elcomercio.pe
"Preventa ‘D-Day The Movie’ en cines de Perú: Precio de entradas, dónde comprarlas y más del film de Suga de BTS",Suga de BTS anuncia ‘Agust D Tour D-Day The Movie’ en cines: Consulta aquí los precios y cómo comprar entradas a la película de su reciente gira como solista.,https://elcomercio.pe/resizer/wdshakTDC2jmwE3mYmqjN7QMbjk=/cloudfront-us-east-1.images.arcpublishing.com/elcomercio/YB34TTXO6NC7DGKDHIPYCW63JI.png,https://elcomercio.pe/respuestas/preventa-de-d-day-the-movie-en-peru-precio-de-entradas-como-comprar-y-mas-del-film-de-suga-de-bts-asiaticas-kpop-tdpe-noticia/,2024-03-11 23:34:27+00:00,https://elcomercio.pe
Congreso aprueba dos mociones para interpelar al ministro del Interior,"El pleno del Congreso de la República aprobó este lunes, 11 de marzo, aprobó una moción de interpelación al ministro del Interior, Víctor Torres.",https://elcomercio.pe/resizer/AGX9NyfV7hVo5ACsNse4wNWNXAM=/cloudfront-us-east-1.images.arcpublishing.com/elcomercio/VIXDA5Z46NBIVGNK75AHDENCEQ.jpg,https://elcomercio.pe/politica/congreso/congreso-aprueba-dos-mociones-para-interpelar-al-ministro-del-interior-parlamento-mininter-gobierno-ultimas-noticia/,2024-03-11 22:49:39+00:00,https://elcomercio.pe
"Precio de la gasolina y diésel en Perú hoy, lunes 11 de marzo",Encuentra los precios más económicos de gasolina y diésel cerca de ti con la app Facilito de Osinergmin.,https://elcomercio.pe/resizer/LZEJg-VWTrXPha6ewCpyFFiaOZs=/cloudfront-us-east-1.images.arcpublishing.com/elcomercio/LEBSL7JZ5ZEW3NCA62HB32KXCE.jpg,https://elcomercio.pe/respuestas/trends/consulta-precios-de-gasolina-y-diesel-en-peru-para-hoy-via-facilito-de-osinergmin-grifos-gasohol-petroleo-tdpe-noticia/,2024-03-11 23:34:00+00:00,https://elcomercio.pe
Trump pide aplazar juicio en Nueva York hasta que Corte Suprema evalúe su inmunidad,"El exmandatario estadounidense Donald Trump pidió este lunes a la justicia de Nueva York que aplace al menos un mes su juicio penal por un caso de pagos a una exactriz porno, hasta que la Corte Suprema se pronuncie sobre su reclamación de inmunidad presidencial.",https://elcomercio.pe/resizer/xqdddXyWS-fue0ayf2l1mcP7_Dk=/cloudfront-us-east-1.images.arcpublishing.com/elcomercio/6OONS5OPTNBT3GYDWSZQGVKWBI.jpg,https://elcomercio.pe/mundo/eeuu/donald-trump-pide-aplazar-juicio-en-nueva-york-hasta-que-corte-suprema-de-estados-unidos-evalue-su-inmunidad-stormy-daniels-manhattan-alvin-bragg-trump-organization-melania-trump-ultimas-noticia/,2024-03-11 23:33:07+00:00,https://elcomercio.pe
"TEMBLOR en Perú hoy, lunes 11 de marzo: Dónde fue el epicentro y magnitud según el IGP","En la siguiente nota podrás conocer el reporte de sismos, epicentro y magnitud según el IGP (Instituto Geofísico del Perú).",https://elcomercio.pe/resizer/E_M31pLyQ9h3TqMstZXSSXUu6aU=/cloudfront-us-east-1.images.arcpublishing.com/elcomercio/I4H7TQH4ZVC4BPLRPMYTXSQABY.jpg,https://elcomercio.pe/peru/temblor-hoy-en-peru-epicentro-magnitud-y-reporte-de-ultimos-sismos-segun-igp-sismo-hoy-donde-fue-hora-terremoto-video-tdpe-noticia/,2024-03-11 23:33:00+00:00,https://elcomercio.pe
"Dólar BCV hoy, 11 de marzo: Tasa oficial del Banco Central de Venezuela",En la siguiente nota podrás consultar la tasa actualizada del dólar el día de hoy según datos del Banco Central de Venezuela.,https://elcomercio.pe/resizer/VI6vP6PFE8ibseV5galXpyTRemw=/cloudfront-us-east-1.images.arcpublishing.com/elcomercio/QFGAXP6IBJHPTCGM2C3CAINKLQ.png,https://elcomercio.pe/respuestas/venezuela/cuanto-es-el-valor-del-dolar-bcv-en-venezuela-hoy-consulta-la-tasa-oficial-del-banco-central-dolartoday-precio-del-dolar-tdpe-noticia/,2024-03-11 23:32:00+00:00,https://elcomercio.pe
Ana Paula Consorte celebra el cumpleaños de su hija mayor en una fiesta de lujo,"La actual pareja de Paolo Guerrero, Ana Paula Consorte, compartió vía Instagram todos los momentos de la fiesta de cumpleaños número 11 de su hija mayor en Brasil. La brasileña estuvo rodeada de sus familiares amigos más cercanos durante la celebración. (Video: @AnaPaulaConsorte)",,https://elcomercio.pe/videos/entretenimiento/ana-paula-consorte-y-la-increible-fiesta-a-su-hija-mayor-paolo-guerrero-universidad-cesar-vallejo-ucv-brasil-nnav-video-instagram-noticia/,2024-03-11 23:32:00+00:00,https://elcomercio.pe
Clima en Perú EN VIVO: incremento de temperatura y reporte de lluvias,"Clima en Perú EN VIVO: Conoce en la siguiente nota el pronostico del clima y temperaturas en las diferentes regiones del Perú, según el Servicio Nacional de Meteorología e Hidrología.",https://elcomercio.pe/resizer/bddv9VpkrbJZC5ZZ7JQ4szjlcbY=/cloudfront-us-east-1.images.arcpublishing.com/elcomercio/TJZXYVSMLBADFHUBICJH5APLRY.jpg,https://elcomercio.pe/respuestas/clima-en-peru-en-vivo-pronosticos-de-temperaturas-en-lima-y-provincias-segun-el-senamhi-ola-de-calor-sensacion-termica-radiacion-uv-fenomeno-del-nino-ultima-hora-lbposting-noticia/,2024-03-11 23:31:50+00:00,https://elcomercio.pe
"Precio del dólar en Perú, lunes 11 de marzo: a cuánto cerró el tipo de cambio hoy","Precio del dólar hoy EN VIVO: cotización en compra y venta del dólar en el Perú en la jornada de hoy, lunes 11 de marzo. Revisa los movimientos de la moneda estadounidense en el mercado nacional.",https://elcomercio.pe/resizer/Tq2KBgtc13D0_GchGBLDLnOp-Co=/cloudfront-us-east-1.images.arcpublishing.com/elcomercio/4JMDAZKS45COPJZKM6P46B2B3U.jpg,https://elcomercio.pe/economia/mercados/precio-del-dolar-hoy-en-peru-2024-cuanto-esta-el-dolar-este-lunes-11-de-marzo-tasa-cotizacion-compra-y-venta-segun-bcr-dolares-a-soles-sbs-ocona-lbposting-noticia/,2024-03-11 23:26:31+00:00,https://elcomercio.pe
